<?xml version="1.0" encoding="UTF-8"?>
<pss:PSSStudyCase id="idvalue0" xmlns:pss="http://www.ieee.org/odm/Schema" xmlns:xsi="http://www.w3.org/2001/XMLSchema-instance" xsi:schemaLocation="http://www.ieee.org/odm/Schema ../schema/ODM_StudyCase.xsd ">
  <pss:schemaVersion>V0.7</pss:schemaVersion>
  <pss:baseCase id="idvalue1">
    <pss:networkCategory>Transmission</pss:networkCategory>
    <pss:analysisCategory>Loadflow</pss:analysisCategory>
    <pss:basePower unit="PU" value="0.0"/>
    <pss:busList>
    	<pss:bus1 xsi:type="LoadflowBusXmlType" id="BusId">
    		<pss:baseVoltage unit="PU" value="0.0" />
    	</pss:bus1>
    </pss:busList>
    <pss:branchList/>
  </pss:baseCase>
</pss:PSSStudyCase>
