<?xml version="1.0" encoding="UTF-8"?>
<pss:PSSStudyCase id="studyCaseId" 
	xmlns:pss="http://www.ieee.org/odm/Schema" 
	xmlns:xsi="http://www.w3.org/2001/XMLSchema-instance" 
	xsi:schemaLocation="http://www.ieee.org/odm/Schema ../../schema/ODM_StudyCase.xsd ">
  <pss:schemaVersion>V0.7</pss:schemaVersion>
  <pss:contentInfo>
    <pss:originalDataFormat>Custom</pss:originalDataFormat>
    <pss:adapterProviderName>www.interpss.org</pss:adapterProviderName>
    <pss:adapterProviderVersion>1.00</pss:adapterProviderVersion>
  </pss:contentInfo>  
  <pss:baseCase id="baseCaseId">
    <pss:networkCategory>Transmission</pss:networkCategory>
    <pss:analysisCategory>Loadflow</pss:analysisCategory>
    <pss:basePower unit="MVA" value="100.0"/>
    <pss:busList/>
    <pss:branchList/>
  </pss:baseCase>
</pss:PSSStudyCase>
